{
  "basis": "unlevered",
  "tax_basis": "pre_tax",
  "currency_code": "USD",
  "day_count": "actual/365f",
  "acquisition_date": "2027-10-01",
  "disposition_date": "2027-12-02",
  "lease_up": {
    "source_variant": "base",
    "currency_code": "USD",
    "cash_dates": [
      {
        "period": "2027-10",
        "date": "2027-10-31"
      },
      {
        "period": "2027-11",
        "date": "2027-12-01"
      }
    ]
  },
  "supplemental": {
    "source_variant": "base",
    "currency_code": "USD"
  },
  "assertions": {
    "cash_amounts_only": true,
    "no_financing_or_investor_tax": true,
    "no_overlapping_economic_amounts": true,
    "reserve_spending_excluded": true,
    "gross_sale_excludes_reserve_release": true,
    "no_terminal_restricted_reserve": true,
    "hold_only_and_exit_settled": true
  },
  "coverage": [
    {
      "slot": "acquisition",
      "category": "purchase_price",
      "rows": [
        0
      ]
    },
    {
      "slot": "acquisition",
      "category": "transaction_costs",
      "rows": [
        1
      ]
    },
    {
      "slot": "acquisition",
      "category": "reserve_net",
      "rows": [
        2
      ]
    },
    {
      "slot": "2027-10",
      "category": "other_income",
      "rows": [
        3
      ]
    },
    {
      "slot": "2027-10",
      "category": "operating_expenses",
      "rows": [
        4
      ]
    },
    {
      "slot": "2027-10",
      "category": "other_capex",
      "zero": "Synthetic scenario explicitly has no cash flow in this category."
    },
    {
      "slot": "2027-10",
      "category": "reserve_net",
      "zero": "Synthetic scenario explicitly has no cash flow in this category."
    },
    {
      "slot": "2027-11",
      "category": "other_income",
      "zero": "Synthetic scenario explicitly has no cash flow in this category."
    },
    {
      "slot": "2027-11",
      "category": "operating_expenses",
      "rows": [
        5
      ]
    },
    {
      "slot": "2027-11",
      "category": "other_capex",
      "rows": [
        6
      ]
    },
    {
      "slot": "2027-11",
      "category": "reserve_net",
      "zero": "Synthetic scenario explicitly has no cash flow in this category."
    },
    {
      "slot": "disposition",
      "category": "gross_sale",
      "rows": [
        7
      ]
    },
    {
      "slot": "disposition",
      "category": "transaction_costs",
      "rows": [
        8
      ]
    },
    {
      "slot": "disposition",
      "category": "reserve_net",
      "rows": [
        9
      ]
    }
  ],
  "disposition_period_rule": "allow_exclusive_end"
}
